{"$schema":"https://json-schema.org/draft/2020-12/schema","$id":"https://grandchallenge.ai/schemas/euclid_diophantine_forge_package.schema.json","title":"EUCLID-DIOPHANTINE-E2E-002 Forge Package","type":"object","additionalProperties":false,"required":["schema_version","package_id","campaign_id","stage","authority_state","governing_authorization","protected_stage1_reuse","problem_card","source_map","status_triage","reconnaissance_ledger","failure_risks","suggested_wp01","certification_route_sketch","solve_handoff","chaidez_documentary_contract","claim_boundary","target_disposition"],"properties":{"schema_version":{"const":"1.0.0"},"package_id":{"const":"MF-EUCLID-DIOPHANTINE-E2E-002-WP00"},"campaign_id":{"const":"EUCLID-DIOPHANTINE-E2E-002"},"stage":{"const":"FORGE_INTAKE_AND_HANDOFF"},"authority_state":{"const":"candidate_provider_handoff"},"governing_authorization":{"type":"object","additionalProperties":false,"required":["programme_repository","programme_protected_head","programme_issue","forge_issue"],"properties":{"programme_repository":{"const":"grandchallenge/MATH-PROGRAMME"},"programme_protected_head":{"pattern":"^[0-9a-f]{40}$"},"programme_issue":{"const":238},"forge_issue":{"const":65}}},"protected_stage1_reuse":{"type":"object","additionalProperties":false,"required":["forge","solve","cert","programme","reuse_policy"],"properties":{"forge":{"type":"object","additionalProperties":false,"required":["repository","merge_commit"],"properties":{"repository":{"type":"string"},"merge_commit":{"pattern":"^[0-9a-f]{40}$"},"package_path":{"type":"string"},"certificate_path":{"type":"string"},"output_path":{"type":"string"},"closeout_path":{"type":"string"},"disposition":{"type":"string"}}},"solve":{"type":"object","additionalProperties":false,"required":["repository","merge_commit"],"properties":{"repository":{"type":"string"},"merge_commit":{"pattern":"^[0-9a-f]{40}$"},"package_path":{"type":"string"},"certificate_path":{"type":"string"},"output_path":{"type":"string"},"closeout_path":{"type":"string"},"disposition":{"type":"string"}}},"cert":{"type":"object","additionalProperties":false,"required":["repository","merge_commit"],"properties":{"repository":{"type":"string"},"merge_commit":{"pattern":"^[0-9a-f]{40}$"},"package_path":{"type":"string"},"certificate_path":{"type":"string"},"output_path":{"type":"string"},"closeout_path":{"type":"string"},"disposition":{"type":"string"}}},"programme":{"type":"object","additionalProperties":false,"required":["repository","merge_commit"],"properties":{"repository":{"type":"string"},"merge_commit":{"pattern":"^[0-9a-f]{40}$"},"package_path":{"type":"string"},"certificate_path":{"type":"string"},"output_path":{"type":"string"},"closeout_path":{"type":"string"},"disposition":{"type":"string"}}},"reuse_policy":{"type":"string"}}},"problem_card":{"type":"object","additionalProperties":false,"required":["title","domain","normalized_statement","quantifiers","input_contract","object_certificate_separation"],"properties":{"title":{"type":"string"},"domain":{"const":"elementary_number_theory"},"normalized_statement":{"type":"string"},"quantifiers":{"type":"object","additionalProperties":false,"required":["a","b","c","x","y","precondition"],"properties":{"a":{"type":"string"},"b":{"type":"string"},"c":{"type":"string"},"x":{"type":"string"},"y":{"type":"string"},"precondition":{"type":"string"}}},"input_contract":{"type":"object","additionalProperties":false,"required":["supported","excluded","gcd_normalization","target_normalization","zero_target_policy"],"properties":{"supported":{"type":"string"},"excluded":{"type":"array","items":{"type":"string"}},"gcd_normalization":{"type":"string"},"target_normalization":{"type":"string"},"zero_target_policy":{"type":"string"}}},"object_certificate_separation":{"type":"object","additionalProperties":false,"required":["sought_object","constructive_witness","unsatisfiable_obstruction","candidate_output","certificate_disposition"],"properties":{"sought_object":{"type":"string"},"constructive_witness":{"type":"string"},"unsatisfiable_obstruction":{"type":"string"},"candidate_output":{"type":"string"},"certificate_disposition":{"type":"string"}}}}},"source_map":{"type":"array","minItems":3,"maxItems":3,"items":{"type":"object","additionalProperties":false,"required":["source_id","kind","locator","status","support_scope"],"properties":{"source_id":{"type":"string"},"kind":{"type":"string"},"locator":{"type":"string"},"status":{"type":"string"},"support_scope":{"type":"string"}}}},"status_triage":{"type":"object","additionalProperties":false,"required":["mathematical_status","forge_status","novelty_status","priority_status","historical_attribution_status","arbitrary_diophantine_completeness_status"],"properties":{"mathematical_status":{"const":"classical_theorem"},"forge_status":{"const":"candidate_ready_for_protected_review"},"novelty_status":{"const":"not_claimed"},"priority_status":{"const":"not_claimed"},"historical_attribution_status":{"type":"string"},"arbitrary_diophantine_completeness_status":{"const":"not_claimed"}}},"reconnaissance_ledger":{"type":"object","additionalProperties":false,"required":["positive_exemplar","negative_exemplar","evidence_class","theorem_effect"],"properties":{"positive_exemplar":{"type":"object","additionalProperties":false,"required":["inputs","protected_gcd","protected_bezout","scale_factor","candidate_solution","divisibility"],"properties":{"inputs":{"type":"object","additionalProperties":false,"required":["a","b","c"],"properties":{"a":{"type":"integer"},"b":{"type":"integer"},"c":{"type":"integer"}}},"protected_gcd":{"type":"integer","minimum":1},"protected_bezout":{"type":"object","additionalProperties":false,"required":["x","y","equation"],"properties":{"x":{"type":"integer"},"y":{"type":"integer"},"equation":{"type":"string"}}},"scale_factor":{"type":"integer"},"candidate_solution":{"type":"object","additionalProperties":false,"required":["x","y","equation"],"properties":{"x":{"type":"integer"},"y":{"type":"integer"},"equation":{"type":"string"}}},"divisibility":{"type":"object","additionalProperties":false,"required":["absolute_target","quotient","remainder"],"properties":{"absolute_target":{"type":"integer","minimum":0},"quotient":{"type":"integer"},"remainder":{"const":0}}}}},"negative_exemplar":{"type":"object","additionalProperties":false,"required":["inputs","protected_gcd","divisibility_obstruction","obstruction_meaning"],"properties":{"inputs":{"type":"object","additionalProperties":false,"required":["a","b","c"],"properties":{"a":{"type":"integer"},"b":{"type":"integer"},"c":{"type":"integer"}}},"protected_gcd":{"type":"integer","minimum":1},"divisibility_obstruction":{"type":"object","additionalProperties":false,"required":["absolute_target","quotient","remainder","equation"],"properties":{"absolute_target":{"type":"integer","minimum":0},"quotient":{"type":"integer","minimum":0},"remainder":{"type":"integer","minimum":0},"equation":{"type":"string"}}},"obstruction_meaning":{"type":"string"}}},"evidence_class":{"const":"exact_candidate_computation_and_divisibility_obstruction"},"theorem_effect":{"const":"none_until_independent_check_and_formal_certification"}}},"failure_risks":{"type":"array","minItems":10,"maxItems":10,"items":{"type":"object","additionalProperties":false,"required":["risk_id","summary","required_rejection"],"properties":{"risk_id":{"pattern":"^DIO-[0-9]{3}$"},"summary":{"type":"string"},"required_rejection":{"type":"string"}}}},"suggested_wp01":{"type":"object","additionalProperties":false,"required":["owner","issue","objective","resource_contract"],"properties":{"owner":{"const":"MATHSOLVE"},"issue":{"const":103},"objective":{"type":"string"},"resource_contract":{"type":"object","additionalProperties":false,"required":["arithmetic","network","randomness","timeout_as_unsat","evidence_forms"],"properties":{"arithmetic":{"type":"string"},"network":{"const":"forbidden"},"randomness":{"const":"forbidden"},"timeout_as_unsat":{"const":"forbidden"},"evidence_forms":{"type":"array","minItems":2,"maxItems":2,"items":{"enum":["constructive_solution","divisibility_obstruction"]}}}}}},"certification_route_sketch":{"type":"object","additionalProperties":false,"required":["owner","issue","independence_requirement","checks"],"properties":{"owner":{"const":"MATHCERT"},"issue":{"const":89},"independence_requirement":{"type":"string"},"checks":{"type":"array","minItems":8,"items":{"type":"string"}}}},"solve_handoff":{"type":"object","additionalProperties":false,"required":["handoff_id","target_repository","target_issue","state","protected_dependency","cases","required_output","forbidden_claims"],"properties":{"handoff_id":{"const":"MF-HANDOFF-EUCLID-DIOPHANTINE-E2E-002"},"target_repository":{"const":"grandchallenge/MATHSOLVE"},"target_issue":{"const":103},"state":{"const":"candidate_pending_protected_forge_merge"},"protected_dependency":{"type":"string"},"cases":{"type":"array","minItems":2,"maxItems":2,"items":{"type":"object","additionalProperties":false,"required":["case_id","inputs","required_evidence"],"properties":{"case_id":{"type":"string"},"inputs":{"type":"object","additionalProperties":false,"required":["a","b","c"],"properties":{"a":{"type":"integer"},"b":{"type":"integer"},"c":{"type":"integer"}}},"required_evidence":{"enum":["constructive_solution","divisibility_obstruction"]}}}},"required_output":{"type":"object","additionalProperties":false,"required":["common_fields","constructive_fields","obstruction_fields","authority_state"],"properties":{"common_fields":{"type":"array","items":{"type":"string"}},"constructive_fields":{"type":"array","items":{"type":"string"}},"obstruction_fields":{"type":"array","items":{"type":"string"}},"authority_state":{"const":"candidate_only"}}},"forbidden_claims":{"type":"array","minItems":7,"items":{"type":"string"}}}},"chaidez_documentary_contract":{"type":"object","additionalProperties":false,"required":["opening","labels","authoritative_surfaces","pedagogical_only_surfaces","edition_sequence"],"properties":{"opening":{"type":"string"},"labels":{"type":"array","items":{"type":"string"}},"authoritative_surfaces":{"type":"array","items":{"type":"string"}},"pedagogical_only_surfaces":{"type":"array","items":{"type":"string"}},"edition_sequence":{"type":"array","minItems":5,"maxItems":5,"items":{"type":"string"}}}},"claim_boundary":{"type":"object","additionalProperties":false,"required":["certifies_mathematics","certifies_constructive_witness","certifies_unsatisfiable_obstruction","claims_arbitrary_diophantine_completeness","claims_novelty","claims_priority","claims_historical_verbatim_equivalence","statement"],"properties":{"certifies_mathematics":{"const":false},"certifies_constructive_witness":{"const":false},"certifies_unsatisfiable_obstruction":{"const":false},"claims_arbitrary_diophantine_completeness":{"const":false},"claims_novelty":{"const":false},"claims_priority":{"const":false},"claims_historical_verbatim_equivalence":{"const":false},"statement":{"type":"string","minLength":40}}},"target_disposition":{"const":"FORGE_ADMITTED_LINEAR_DIOPHANTINE_SOLVABILITY_EXTENSION"}}}
